{
  "extensions": [
    {
      "artifact_available": true,
      "channel": "nightly",
      "distribution_family": "therock",
      "extension": "triton",
      "first_observed_at": "2026-09-07T21:24:14Z",
      "id": "triton:therock:linux:nightly:10.1.0a20260820:3.8.0+gitdf3f91dd.rocm10.1.0a20260820:cp310,cp311,cp312,cp313,cp314",
      "last_observed_at": "2026-10-19T21:18:35Z",
      "lifecycle": "historical",
      "package_name": "triton",
      "platform": "linux",
      "python_tags": [
        "cp310",
        "cp311",
        "cp312",
        "cp313",
        "cp314"
      ],
      "rocm_version": "10.1.0a20260820",
      "source_id": "packages-nightly-archive-linux",
      "version": "3.8.0+gitdf3f91dd.rocm10.1.0a20260820"
    },
    {
      "artifact_available": true,
      "channel": "nightly",
      "distribution_family": "therock",
      "extension": "triton",
      "first_observed_at": "2026-09-07T21:22:58Z",
      "id": "triton:therock:linux:nightly:10.1.0a20260907:3.8.0+gitc01b6774.rocm10.1.0a20260907:cp310,cp311,cp312,cp313,cp314",
      "last_observed_at": "2026-09-07T21:36:06Z",
      "lifecycle": "historical",
      "package_name": "triton",
      "platform": "linux",
      "python_tags": [
        "cp310",
        "cp311",
        "cp312",
        "cp313",
        "cp314"
      ],
      "rocm_version": "10.1.0a20260907",
      "source_id": "packages-nightly-linux",
      "version": "3.8.0+gitc01b6774.rocm10.1.0a20260907"
    },
    {
      "artifact_available": true,
      "channel": "nightly",
      "distribution_family": "therock",
      "extension": "triton",
      "first_observed_at": "2026-09-08T19:41:01Z",
      "id": "triton:therock:linux:nightly:10.1.0a20260908:3.8.0+gitc01b6774.rocm10.1.0a20260908:cp310,cp311,cp312,cp313,cp314",
      "last_observed_at": "2026-09-08T19:41:01Z",
      "lifecycle": "historical",
      "package_name": "triton",
      "platform": "linux",
      "python_tags": [
        "cp310",
        "cp311",
        "cp312",
        "cp313",
        "cp314"
      ],
      "rocm_version": "10.1.0a20260908",
      "source_id": "packages-nightly-linux",
      "version": "3.8.0+gitc01b6774.rocm10.1.0a20260908"
    },
    {
      "artifact_available": true,
      "channel": "nightly",
      "distribution_family": "therock",
      "extension": "triton",
      "first_observed_at": "2026-09-09T19:34:20Z",
      "id": "triton:therock:linux:nightly:10.1.0a20260909:3.8.0+gitc01b6774.rocm10.1.0a20260909:cp310,cp311,cp312,cp313,cp314",
      "last_observed_at": "2026-09-09T19:34:20Z",
      "lifecycle": "historical",
      "package_name": "triton",
      "platform": "linux",
      "python_tags": [
        "cp310",
        "cp311",
        "cp312",
        "cp313",
        "cp314"
      ],
      "rocm_version": "10.1.0a20260909",
      "source_id": "packages-nightly-linux",
      "version": "3.8.0+gitc01b6774.rocm10.1.0a20260909"
    },
    {
      "artifact_available": true,
      "channel": "nightly",
      "distribution_family": "therock",
      "extension": "triton",
      "first_observed_at": "2026-09-10T19:23:29Z",
      "id": "triton:therock:linux:nightly:10.1.0a20260910:3.8.0+gitc01b6774.rocm10.1.0a20260910:cp310,cp311,cp312,cp313,cp314",
      "last_observed_at": "2026-09-10T19:23:29Z",
      "lifecycle": "historical",
      "package_name": "triton",
      "platform": "linux",
      "python_tags": [
        "cp310",
        "cp311",
        "cp312",
        "cp313",
        "cp314"
      ],
      "rocm_version": "10.1.0a20260910",
      "source_id": "packages-nightly-linux",
      "version": "3.8.0+gitc01b6774.rocm10.1.0a20260910"
    },
    {
      "artifact_available": true,
      "channel": "nightly",
      "distribution_family": "therock",
      "extension": "triton",
      "first_observed_at": "2026-09-11T19:22:08Z",
      "id": "triton:therock:linux:nightly:10.2.0a20260911:3.8.0+gitc01b6774.rocm10.2.0a20260911:cp310,cp311,cp312,cp313,cp314",
      "last_observed_at": "2026-09-11T19:22:08Z",
      "lifecycle": "historical",
      "package_name": "triton",
      "platform": "linux",
      "python_tags": [
        "cp310",
        "cp311",
        "cp312",
        "cp313",
        "cp314"
      ],
      "rocm_version": "10.2.0a20260911",
      "source_id": "packages-nightly-linux",
      "version": "3.8.0+gitc01b6774.rocm10.2.0a20260911"
    },
    {
      "artifact_available": true,
      "channel": "nightly",
      "distribution_family": "therock",
      "extension": "triton",
      "first_observed_at": "2026-09-12T18:53:07Z",
      "id": "triton:therock:linux:nightly:10.2.0a20260912:3.8.0+gitc01b6774.rocm10.2.0a20260912:cp310,cp311,cp312,cp313,cp314",
      "last_observed_at": "2026-09-12T18:53:07Z",
      "lifecycle": "historical",
      "package_name": "triton",
      "platform": "linux",
      "python_tags": [
        "cp310",
        "cp311",
        "cp312",
        "cp313",
        "cp314"
      ],
      "rocm_version": "10.2.0a20260912",
      "source_id": "packages-nightly-linux",
      "version": "3.8.0+gitc01b6774.rocm10.2.0a20260912"
    },
    {
      "artifact_available": true,
      "channel": "nightly",
      "distribution_family": "therock",
      "extension": "triton",
      "first_observed_at": "2026-09-13T19:09:19Z",
      "id": "triton:therock:linux:nightly:10.2.0a20260913:3.8.0+gitc01b6774.rocm10.2.0a20260913:cp310,cp311,cp312,cp313,cp314",
      "last_observed_at": "2026-09-13T19:09:19Z",
      "lifecycle": "historical",
      "package_name": "triton",
      "platform": "linux",
      "python_tags": [
        "cp310",
        "cp311",
        "cp312",
        "cp313",
        "cp314"
      ],
      "rocm_version": "10.2.0a20260913",
      "source_id": "packages-nightly-linux",
      "version": "3.8.0+gitc01b6774.rocm10.2.0a20260913"
    },
    {
      "artifact_available": true,
      "channel": "nightly",
      "distribution_family": "therock",
      "extension": "triton",
      "first_observed_at": "2026-09-14T20:41:48Z",
      "id": "triton:therock:linux:nightly:10.2.0a20260914:3.8.0+gitc01b6774.rocm10.2.0a20260914:cp310,cp311,cp312,cp313,cp314",
      "last_observed_at": "2026-09-14T20:41:48Z",
      "lifecycle": "historical",
      "package_name": "triton",
      "platform": "linux",
      "python_tags": [
        "cp310",
        "cp311",
        "cp312",
        "cp313",
        "cp314"
      ],
      "rocm_version": "10.2.0a20260914",
      "source_id": "packages-nightly-linux",
      "version": "3.8.0+gitc01b6774.rocm10.2.0a20260914"
    },
    {
      "artifact_available": true,
      "channel": "nightly",
      "distribution_family": "therock",
      "extension": "triton",
      "first_observed_at": "2026-09-15T19:56:04Z",
      "id": "triton:therock:linux:nightly:10.2.0a20260915:3.8.0+gitc01b6774.rocm10.2.0a20260915:cp310,cp311,cp312,cp313,cp314",
      "last_observed_at": "2026-09-15T19:56:04Z",
      "lifecycle": "historical",
      "package_name": "triton",
      "platform": "linux",
      "python_tags": [
        "cp310",
        "cp311",
        "cp312",
        "cp313",
        "cp314"
      ],
      "rocm_version": "10.2.0a20260915",
      "source_id": "packages-nightly-linux",
      "version": "3.8.0+gitc01b6774.rocm10.2.0a20260915"
    },
    {
      "artifact_available": true,
      "channel": "nightly",
      "distribution_family": "therock",
      "extension": "triton",
      "first_observed_at": "2026-09-16T19:48:50Z",
      "id": "triton:therock:linux:nightly:10.2.0a20260916:3.8.0+gitc01b6774.rocm10.2.0a20260916:cp310,cp311,cp312,cp313,cp314",
      "last_observed_at": "2026-09-16T19:48:50Z",
      "lifecycle": "historical",
      "package_name": "triton",
      "platform": "linux",
      "python_tags": [
        "cp310",
        "cp311",
        "cp312",
        "cp313",
        "cp314"
      ],
      "rocm_version": "10.2.0a20260916",
      "source_id": "packages-nightly-linux",
      "version": "3.8.0+gitc01b6774.rocm10.2.0a20260916"
    },
    {
      "artifact_available": true,
      "channel": "nightly",
      "distribution_family": "therock",
      "extension": "triton",
      "first_observed_at": "2026-09-17T19:57:01Z",
      "id": "triton:therock:linux:nightly:10.2.0a20260917:3.8.0+gitc01b6774.rocm10.2.0a20260917:cp310,cp311,cp312,cp313,cp314",
      "last_observed_at": "2026-09-17T19:57:01Z",
      "lifecycle": "historical",
      "package_name": "triton",
      "platform": "linux",
      "python_tags": [
        "cp310",
        "cp311",
        "cp312",
        "cp313",
        "cp314"
      ],
      "rocm_version": "10.2.0a20260917",
      "source_id": "packages-nightly-linux",
      "version": "3.8.0+gitc01b6774.rocm10.2.0a20260917"
    },
    {
      "artifact_available": true,
      "channel": "nightly",
      "distribution_family": "therock",
      "extension": "triton",
      "first_observed_at": "2026-09-18T19:21:12Z",
      "id": "triton:therock:linux:nightly:10.2.0a20260918:3.8.0+gitc01b6774.rocm10.2.0a20260918:cp310,cp311,cp312,cp313,cp314",
      "last_observed_at": "2026-09-19T19:06:19Z",
      "lifecycle": "historical",
      "package_name": "triton",
      "platform": "linux",
      "python_tags": [
        "cp310",
        "cp311",
        "cp312",
        "cp313",
        "cp314"
      ],
      "rocm_version": "10.2.0a20260918",
      "source_id": "packages-nightly-linux",
      "version": "3.8.0+gitc01b6774.rocm10.2.0a20260918"
    },
    {
      "artifact_available": true,
      "channel": "nightly",
      "distribution_family": "therock",
      "extension": "triton",
      "first_observed_at": "2026-09-20T19:12:09Z",
      "id": "triton:therock:linux:nightly:10.2.0a20260920:3.8.0+gitc01b6774.rocm10.2.0a20260920:cp310,cp311,cp312,cp313,cp314",
      "last_observed_at": "2026-09-20T19:12:09Z",
      "lifecycle": "historical",
      "package_name": "triton",
      "platform": "linux",
      "python_tags": [
        "cp310",
        "cp311",
        "cp312",
        "cp313",